{"contract_version":"1.0-gate-a-dev","scenario_id":"blackhole-long-chat-baseline-v1","checkpoint":150,"queries":{"q-subscriptions-current":{"assertions":[{"state_key":"subscription.streamly.status","knowledge_status":"known","value":"active","source_refs":["evt-091","evt-131"],"confirmation_ref":"evt-131"},{"state_key":"subscription.streamly.current_monthly_cost_eur","knowledge_status":"known","value":{"latest_charged_eur":18.00,"announced_monthly_eur":18.00,"announced_from":"2026-03"},"source_refs":["evt-111","evt-141"]},{"state_key":"subscription.gymflex.current_contract","knowledge_status":"known","value":{"contract_id":"GYM-NEW","status":"current","monthly_cost_eur":31.00,"effective_from":"2026-03-01"},"source_refs":["evt-069","evt-089","evt-109","evt-149"],"confirmation_ref":"evt-109"}]},"q-subscriptions-history":{"assertions":[{"state_key":"subscription.streamly.price_history","knowledge_status":"known","value":{"supported_monthly_prices_eur":[12.00,14.00,16.00,18.00],"supported_changes":[{"from_eur":12.00,"to_eur":14.00},{"from_eur":14.00,"to_eur":16.00},{"from_eur":16.00,"to_eur":18.00}]},"source_refs":["evt-001","evt-021","evt-051","evt-061","evt-101","evt-111","evt-141"]},{"state_key":"subscription.gymflex.price_change","knowledge_status":"known","value":{"old_contract":"GYM-OLD","new_contract":"GYM-NEW","from_eur":29.00,"to_eur":31.00},"source_refs":["evt-029","evt-069","evt-149"]}]},"q-attention-14d":{"assertions":[{"state_key":"attention.replacement_parcel","knowledge_status":"known","value":{"status":"open","owner":"Sam","deadline":"2026-03-05"},"source_refs":["evt-094","evt-134","evt-144"],"confirmation_ref":"evt-144"},{"state_key":"attention.bank_standing_order_change","knowledge_status":"known","value":{"status":"proposal","approval_required":true,"execution":"not executed"},"source_refs":["evt-080","evt-100","evt-110","evt-130"]},{"state_key":"attention.bank_standing_order_change.deadline","knowledge_status":"unknown","unknown_reason":"No deadline is stated for the proposed standing-order change.","source_refs":["evt-010","evt-080","evt-110","evt-130"]}]},"q-insurance-expiry":{"assertions":[{"state_key":"insurance.roadsure.current_policy_id","knowledge_status":"known","value":"RS-NEW","source_refs":["evt-045","evt-065","evt-085","evt-095","evt-125"]},{"state_key":"insurance.roadsure.current_policy_period","knowledge_status":"known","value":{"active_from":"2026-07-01","expires":"2027-06-30"},"source_refs":["evt-045","evt-105","evt-135"],"confirmation_ref":"evt-135"},{"state_key":"insurance.roadsure.current_policy_monthly_premium_eur","knowledge_status":"known","value":42.00,"source_refs":["evt-055"]},{"state_key":"insurance.roadsure.active_policy_at_checkpoint","knowledge_status":"known","value":{"policy_id":"RS-OLD","active_from":"2026-01-01","expires":"2026-06-30"},"source_refs":["evt-005","evt-025","evt-085"]},{"state_key":"insurance.roadsure.old_policy_status","knowledge_status":"known","value":"superseded","source_refs":["evt-085","evt-139"]},{"state_key":"insurance.roadsure.old_policy_cancellation_date","knowledge_status":"unknown","unknown_reason":"The cancellation date is not printed clearly in the record.","source_refs":["evt-075"]}]},"q-orange-costs":{"assertions":[{"state_key":"orange.bill.2026-01.amount_eur","knowledge_status":"known","value":29.90,"source_refs":["evt-002"]},{"state_key":"orange.bill.2026-02.amount_eur","knowledge_status":"known","value":29.90,"source_refs":["evt-012"]},{"state_key":"orange.bill.2026-03.amount_eur","knowledge_status":"known","value":29.90,"source_refs":["evt-022"]},{"state_key":"orange.bill.2026-04.amount_eur","knowledge_status":"unknown","unknown_reason":"No bill was captured for this period; coverage is missing, not zero.","source_refs":["evt-032"]},{"state_key":"orange.bill.2026-05.amount_eur","knowledge_status":"known","value":31.90,"source_refs":["evt-042"]},{"state_key":"orange.bill.2026-06.amount_eur","knowledge_status":"known","value":31.90,"source_refs":["evt-052"]},{"state_key":"orange.bill.2026-07.amount_eur","knowledge_status":"known","value":31.90,"source_refs":["evt-062"]},{"state_key":"orange.bill.2026-08.amount_eur","knowledge_status":"unknown","unknown_reason":"No bill was captured for this period; coverage is missing, not zero.","source_refs":["evt-072"]},{"state_key":"orange.bill.2026-09.amount_eur","knowledge_status":"known","value":33.90,"source_refs":["evt-082"]},{"state_key":"orange.bill.2026-10.amount_eur","knowledge_status":"known","value":33.90,"source_refs":["evt-092"]},{"state_key":"orange.bill.2026-11.amount_eur","knowledge_status":"known","value":33.90,"source_refs":["evt-102"]},{"state_key":"orange.bill.2026-12.amount_eur","knowledge_status":"known","value":35.90,"source_refs":["evt-112"]},{"state_key":"orange.bill.2027-01.amount_eur","knowledge_status":"known","value":35.90,"source_refs":["evt-122"]},{"state_key":"orange.bill.2027-02.amount_eur","knowledge_status":"unknown","unknown_reason":"No bill was captured for this period; coverage is missing, not zero.","source_refs":["evt-132"]},{"state_key":"orange.bill.2027-03.amount_eur","knowledge_status":"known","value":35.90,"source_refs":["evt-142"]},{"state_key":"orange.observed_totals","knowledge_status":"known","value":{"observed_bill_count":12,"observed_total_eur":394.80,"by_year":{"2026":323.00,"2027":71.80},"excludes_periods":["2026-04","2026-08","2027-02"]},"source_refs":["evt-002","evt-012","evt-022","evt-042","evt-052","evt-062","evt-082","evt-092","evt-102","evt-112","evt-122","evt-142"]}]},"q-marketone-observations":{"assertions":[{"state_key":"marketone.purchase_observations","knowledge_status":"known","value":[{"bars":3,"amount_eur":9.00},{"bars":6,"amount_eur":18.00},{"bars":2,"amount_eur":6.00},{"bars":10,"amount_eur":30.00},{"bars":4,"amount_eur":12.00}],"source_refs":["evt-003","evt-043","evt-063","evt-103","evt-133"]},{"state_key":"marketone.reported_purchase_totals","knowledge_status":"known","value":{"bars":25,"amount_eur":75.00},"source_refs":["evt-003","evt-043","evt-063","evt-103","evt-133"]},{"state_key":"marketone.consumption_observations","knowledge_status":"known","value":[{"bars":1},{"bars":2},{"bars":1},{"bars":2},{"bars":3},{"bars":4},{"bars":0}],"source_refs":["evt-013","evt-023","evt-053","evt-073","evt-093","evt-123","evt-143"]},{"state_key":"marketone.explicit_consumption_statement_sum_bars","knowledge_status":"known","value":13,"source_refs":["evt-013","evt-023","evt-053","evt-073","evt-093","evt-123","evt-143"]},{"state_key":"marketone.consumption.2026-01-12","knowledge_status":"unknown","unknown_reason":"A direct two-bar consumption capture conflicts with a later statement that no consumption note exists for this date.","source_refs":["evt-023","evt-033"]},{"state_key":"marketone.consumption.2026-02-10","knowledge_status":"unknown","unknown_reason":"The record explicitly says whether a bar was eaten was not recorded.","source_refs":["evt-083"]},{"state_key":"marketone.consumption.2026-02-20","knowledge_status":"unknown","unknown_reason":"No consumption observation was captured for this date.","source_refs":["evt-113"]},{"state_key":"marketone.purchase_consumption_linkage","knowledge_status":"unknown","unknown_reason":"The captures do not establish which purchases supplied the consumed bars or the remaining inventory.","source_refs":["evt-003","evt-013","evt-023","evt-043","evt-053","evt-063","evt-073","evt-093","evt-103","evt-123","evt-133","evt-143"]}]},"q-tasks-state":{"assertions":[{"state_key":"task.replacement_parcel.current","knowledge_status":"known","value":{"status":"open","owner":"Sam","deadline":"2026-03-05"},"source_refs":["evt-094","evt-134","evt-144"],"confirmation_ref":"evt-144"},{"state_key":"task.replacement_parcel.history","knowledge_status":"known","value":[{"owner":"Alex","action":"assigned","deadline":"2026-02-25"},{"owner":"Alex","action":"picked_up"},{"owner":"Sam","action":"assigned"},{"owner":"Alex","action":"reassigned_to"},{"owner":"Alex","action":"completed"},{"action":"reopened_after_non_acceptance"},{"owner":"Sam","action":"to_complete","deadline":"2026-03-05"}],"source_refs":["evt-044","evt-054","evt-064","evt-074","evt-084","evt-094","evt-124","evt-134","evt-144"]},{"state_key":"task.original_parcel_pickup.status","knowledge_status":"known","value":"cancelled; no collection needed","source_refs":["evt-004","evt-014","evt-024","evt-034"],"confirmation_ref":"evt-034"},{"state_key":"task.library_books.status","knowledge_status":"known","value":{"status":"completed","owner":"Sam"},"source_refs":["evt-104","evt-114"],"confirmation_ref":"evt-114"},{"state_key":"task.jordan_appointment_reminder.request","knowledge_status":"known","value":"requested","source_refs":["evt-027"]},{"state_key":"task.jordan_appointment_reminder.completion","knowledge_status":"unknown","unknown_reason":"No completion or cancellation capture is present for the reminder request.","source_refs":["evt-027","evt-138"]},{"state_key":"task.jordan_message_reply.request","knowledge_status":"known","value":"reply needed","source_refs":["evt-087"]},{"state_key":"task.jordan_message_reply.completion","knowledge_status":"unknown","unknown_reason":"No completion or cancellation capture is present for the reply request.","source_refs":["evt-087"]},{"state_key":"task.blue_folder.request","knowledge_status":"known","value":"requested by Jordan","source_refs":["evt-007"]},{"state_key":"task.blue_folder.completion","knowledge_status":"unknown","unknown_reason":"No completion or cancellation capture is present for bringing the blue folder.","source_refs":["evt-007"]}]},"q-unresolved":{"assertions":[{"state_key":"homefix.current_amount_eur","knowledge_status":"unknown","unknown_reason":"The quoted, draft, and later amounts conflict: 180.00, 240.00, 220.00, and 250.00 EUR; later records leave 220.00 versus 250.00 unresolved.","source_refs":["evt-008","evt-048","evt-058","evt-068","evt-088","evt-098","evt-118","evt-128","evt-148"]},{"state_key":"jordan.